[
  {
    "id": "binance",
    "name": "Binance",
    "slug": "binance",
    "website": "https://www.binance.com",
    "logo_url": "https://assets.bitsark.com/logos/binance.svg",
    "monitored_by_dolarmap": true,
    "updated_at": "2026-04-22T21:56:00Z",
    "operational_details_br": {
      "cnpj": "45.165.233/0001-82",
      "bcb_authorized": false,
      "accepts_pix": true,
      "main_jurisdiction_iso": "SC"
    },
    "fiscal_details_br": {
      "tax_regime": "offshore_law_14754",
      "monthly_brl_trade_exemption": 0,
      "exchange_rfb_reports": [
        "decripto_annually"
      ],
      "user_rfb_action_monthly": [
        "report_in1888_if_traded_over_30k",
        "pay_darf_if_profit"
      ]
    },
    "fees": {
      "maker": 0.001,
      "taker": 0.001,
      "fee_url": "https://www.binance.com/pt-BR/fee/schedule",
      "note": {
        "en": "25% discount when paying fees with BNB.",
        "pt": "25% de desconto ao pagar as taxas com BNB."
      }
    }
  },
  {
    "id": "okx",
    "name": "OKX Brasil",
    "slug": "okx",
    "website": "https://www.okx.com",
    "logo_url": "https://assets.bitsark.com/logos/okx.svg",
    "monitored_by_dolarmap": true,
    "updated_at": "2026-04-22T21:56:00Z",
    "operational_details_br": {
      "cnpj": "50.459.025/0001-26",
      "bcb_authorized": false,
      "accepts_pix": true,
      "main_jurisdiction_iso": "BR"
    },
    "fiscal_details_br": {
      "tax_regime": "domestic_exchange_foreign_origin",
      "monthly_brl_trade_exemption": 35000,
      "exchange_rfb_reports": [
        "in_1888_monthly"
      ],
      "user_rfb_action_monthly": []
    },
    "fees": {
      "maker": 0.001,
      "taker": 0.004,
      "fee_url": "https://www.okx.com/pt-br/fees",
      "note": {
        "en": "Tiered fee structure based on 30-day volume and OKB holdings.",
        "pt": "Estrutura de taxas escalonada conforme o volume de 30 dias e a quantidade de OKB."
      }
    }
  },
  {
    "id": "bybit",
    "name": "Bybit",
    "slug": "bybit",
    "website": "https://www.bybit.com",
    "logo_url": "https://assets.bitsark.com/logos/bybit.svg",
    "monitored_by_dolarmap": true,
    "updated_at": "2026-04-22T21:56:00Z",
    "operational_details_br": {
      "cnpj": "35.491.577/0001-28",
      "bcb_authorized": false,
      "accepts_pix": true,
      "main_jurisdiction_iso": "VG"
    },
    "fiscal_details_br": {
      "tax_regime": "domestic_exchange_foreign_origin",
      "monthly_brl_trade_exemption": 35000,
      "exchange_rfb_reports": [
        "in_1888_monthly"
      ],
      "user_rfb_action_monthly": []
    },
    "fees": {
      "maker": 0.001,
      "taker": 0.001,
      "fee_url": "https://www.bybit.com/en/help-center/article/Trading-Fee-Structure",
      "note": {
        "en": "Spot maker/taker 0.1%. Futures fees differ.",
        "pt": "Maker/taker spot de 0,1%. As taxas de futuros são diferentes."
      }
    }
  },
  {
    "id": "bitget",
    "name": "Bitget",
    "slug": "bitget",
    "website": "https://www.bitget.com",
    "logo_url": "https://assets.bitsark.com/logos/bitget.svg",
    "monitored_by_dolarmap": true,
    "updated_at": "2026-04-22T21:56:00Z",
    "operational_details_br": {
      "cnpj": null,
      "bcb_authorized": false,
      "accepts_pix": false,
      "main_jurisdiction_iso": "SC"
    },
    "fiscal_details_br": {
      "tax_regime": "offshore_law_14754",
      "monthly_brl_trade_exemption": 0,
      "exchange_rfb_reports": [],
      "user_rfb_action_monthly": [
        "report_in1888_if_traded_over_30k",
        "pay_darf_if_profit"
      ]
    },
    "fees": {
      "maker": 0.001,
      "taker": 0.001,
      "fee_url": "https://www.bitget.com/en/rate/fee",
      "note": {
        "en": "BGB token holders receive fee discounts.",
        "pt": "Detentores do token BGB recebem descontos nas taxas."
      }
    }
  },
  {
    "id": "kucoin",
    "name": "KuCoin",
    "slug": "kucoin",
    "website": "https://www.kucoin.com",
    "logo_url": "https://assets.bitsark.com/logos/kucoin.svg",
    "monitored_by_dolarmap": true,
    "updated_at": "2026-04-22T21:56:00Z",
    "operational_details_br": {
      "cnpj": null,
      "bcb_authorized": false,
      "accepts_pix": true,
      "main_jurisdiction_iso": "SC"
    },
    "fiscal_details_br": {
      "tax_regime": "offshore_law_14754",
      "monthly_brl_trade_exemption": 0,
      "exchange_rfb_reports": [],
      "user_rfb_action_monthly": [
        "report_in1888_if_traded_over_30k",
        "pay_darf_if_profit"
      ]
    },
    "fees": {
      "maker": 0.001,
      "taker": 0.001,
      "fee_url": "https://www.kucoin.com/announcement/en-fee",
      "note": {
        "en": "KCS holders receive up to 20% fee discount.",
        "pt": "Detentores de KCS recebem até 20% de desconto nas taxas."
      }
    }
  },
  {
    "id": "mexc",
    "name": "MEXC",
    "slug": "mexc",
    "website": "https://www.mexc.com",
    "logo_url": "https://assets.bitsark.com/logos/mexc.svg",
    "monitored_by_dolarmap": true,
    "updated_at": "2026-04-22T21:56:00Z",
    "operational_details_br": {
      "cnpj": null,
      "bcb_authorized": false,
      "accepts_pix": true,
      "main_jurisdiction_iso": "SC"
    },
    "fiscal_details_br": {
      "tax_regime": "offshore_law_14754",
      "monthly_brl_trade_exemption": 0,
      "exchange_rfb_reports": [],
      "user_rfb_action_monthly": [
        "report_in1888_if_traded_over_30k",
        "pay_darf_if_profit"
      ]
    },
    "fees": {
      "maker": 0.0,
      "taker": 0.0,
      "fee_url": "https://www.mexc.com/fee",
      "note": {
        "en": "Spot maker/taker currently 0%. Futures fees apply separately.",
        "pt": "Maker/taker spot atualmente em 0%. As taxas de futuros são cobradas à parte."
      }
    }
  },
  {
    "id": "foxbit",
    "name": "Foxbit",
    "slug": "foxbit",
    "website": "https://foxbit.com.br",
    "logo_url": "https://assets.bitsark.com/logos/foxbit.svg",
    "monitored_by_dolarmap": true,
    "updated_at": "2026-04-22T21:56:00Z",
    "operational_details_br": {
      "cnpj": "21.246.584/0002-30",
      "bcb_authorized": true,
      "accepts_pix": true,
      "main_jurisdiction_iso": "BR"
    },
    "fiscal_details_br": {
      "tax_regime": "domestic_exchange",
      "monthly_brl_trade_exemption": 35000,
      "exchange_rfb_reports": [
        "in_1888_monthly"
      ],
      "user_rfb_action_monthly": []
    },
    "fees": {
      "maker": 0.003,
      "taker": 0.005,
      "fee_url": "https://foxbit.com.br/taxas/",
      "note": {
        "en": "Fees vary by trading volume. Pix deposits free; BRL withdrawals may incur a small fee.",
        "pt": "As taxas variam conforme o volume negociado. Depósitos via Pix são gratuitos; saques em BRL podem ter uma pequena taxa."
      }
    }
  },
  {
    "id": "novadax",
    "name": "NovaDAX",
    "slug": "novadax",
    "website": "https://www.novadax.com.br",
    "logo_url": "https://assets.bitsark.com/logos/novadax.svg",
    "monitored_by_dolarmap": true,
    "updated_at": "2026-04-22T21:56:00Z",
    "operational_details_br": {
      "cnpj": "31.745.082/0001-27",
      "bcb_authorized": true,
      "accepts_pix": true,
      "main_jurisdiction_iso": "BR"
    },
    "fiscal_details_br": {
      "tax_regime": "domestic_exchange",
      "monthly_brl_trade_exemption": 35000,
      "exchange_rfb_reports": [
        "in_1888_monthly"
      ],
      "user_rfb_action_monthly": []
    },
    "fees": {
      "maker": 0.003,
      "taker": 0.005,
      "fee_url": "https://www.novadax.com.br/taxas-e-limites",
      "note": {
        "en": "ONG token holders receive fee discounts. Pix available for BRL operations.",
        "pt": "Detentores do token ONG recebem descontos nas taxas. Pix disponível para operações em BRL."
      }
    }
  },
  {
    "id": "brasil-bitcoin",
    "name": "Brasil Bitcoin",
    "slug": "brasil-bitcoin",
    "website": "https://brasilbitcoin.com.br",
    "logo_url": "https://assets.bitsark.com/logos/brasil-bitcoin.svg",
    "monitored_by_dolarmap": true,
    "updated_at": "2026-04-22T21:56:00Z",
    "operational_details_br": {
      "cnpj": "29.519.837/0001-23",
      "bcb_authorized": false,
      "accepts_pix": true,
      "main_jurisdiction_iso": "BR"
    },
    "fiscal_details_br": {
      "tax_regime": "domestic_exchange",
      "monthly_brl_trade_exemption": 35000,
      "exchange_rfb_reports": [
        "in_1888_monthly"
      ],
      "user_rfb_action_monthly": []
    },
    "fees": {
      "maker": 0.005,
      "taker": 0.005,
      "fee_url": "https://brasilbitcoin.com.br/taxas",
      "note": {
        "en": "Flat 0.5% trading fee. Pix available for BRL deposits and withdrawals.",
        "pt": "Taxa de negociação fixa de 0,5%. Pix disponível para depósitos e saques em BRL."
      }
    }
  },
  {
    "id": "coinext",
    "name": "Coinext",
    "slug": "coinext",
    "website": "https://coinext.com.br",
    "logo_url": "https://assets.bitsark.com/logos/coinext.svg",
    "monitored_by_dolarmap": true,
    "updated_at": "2026-04-22T21:56:00Z",
    "operational_details_br": {
      "cnpj": "29.242.868/0001-80",
      "bcb_authorized": false,
      "accepts_pix": true,
      "main_jurisdiction_iso": "BR"
    },
    "fiscal_details_br": {
      "tax_regime": "domestic_exchange",
      "monthly_brl_trade_exemption": 35000,
      "exchange_rfb_reports": [
        "in_1888_monthly"
      ],
      "user_rfb_action_monthly": []
    },
    "fees": {
      "maker": 0.0025,
      "taker": 0.005,
      "fee_url": "https://coinext.com.br/taxas-limites-prazos",
      "note": {
        "en": "Pix available for BRL deposits and withdrawals.",
        "pt": "Pix disponível para depósitos e saques em BRL."
      }
    }
  },
  {
    "id": "bitso",
    "name": "Bitso",
    "slug": "bitso",
    "website": "https://bitso.com",
    "logo_url": "https://assets.bitsark.com/logos/bitso.svg",
    "monitored_by_dolarmap": true,